{
  "version": "stgen-plan-v2",
  "meta": {
    "drawing_type": "S_RC_REBAR_DETAIL",
    "sheet_id": "S601",
    "title": "TBD",
    "units": "mm",
    "target_dxf_path": "TBD.dxf",
    "created_by": "PlannerLLM",
    "created_at": "2026-01-07"
  },
  "assumptions": [
    "TODO: 필요한 누락값은 assumptions에 기록"
  ],
  "policy": {
    "avoid_scale": true,
    "layer_policy": "SET_CURRENT_LAYER",
    "forbid_tools": []
  },
  "vars": {
    "extents": {
      "min": [
        0,
        0
      ],
      "max": [
        12000,
        8000
      ]
    }
  },
  "sequence": [
    {
      "id": "00.status",
      "tool": "get_dxf_summary",
      "args": {}
    },
    {
      "id": "01.layers",
      "macro": "macro:setup_layers",
      "args": {
        "layers": [
          {
            "name": "S-REBAR",
            "aci": 7,
            "linetype": "CONTINUOUS",
            "visible": true
          },
          {
            "name": "S-NOTE",
            "aci": 7,
            "linetype": "CONTINUOUS",
            "visible": true
          },
          {
            "name": "Z-TBD",
            "aci": 1,
            "linetype": "DASHED",
            "visible": true
          }
        ]
      }
    },
    {
      "id": "10.rebar",
      "macro": "macro:rc_rebar_detail",
      "args": {
        "layer": "S-REBAR",
        "note_layer": "S-NOTE",
        "text_height": 120,
        "bars": [
          {
            "shape_points": [
              [
                0,
                0
              ],
              [
                1000,
                0
              ],
              [
                1000,
                500
              ]
            ],
            "mark": "B1-D13@200",
            "label_point": [
              1100,
              500
            ]
          }
        ]
      }
    },
    {
      "id": "90.qa",
      "macro": "macro:qa_snapshot",
      "args": {}
    },
    {
      "id": "99.save",
      "macro": "macro:fit_and_save",
      "args": {
        "path": "S601_rebar_out.dxf"
      }
    }
  ]
}