{
  "version": "stgen-plan-v2",
  "meta": {
    "drawing_type": "S_MEMBER_SCHEDULE",
    "sheet_id": "S701",
    "title": "TBD",
    "units": "mm",
    "target_dxf_path": "TBD.dxf",
    "created_by": "PlannerLLM",
    "created_at": "2026-01-07"
  },
  "assumptions": [
    "TODO: 필요한 누락값은 assumptions에 기록"
  ],
  "policy": {
    "avoid_scale": true,
    "layer_policy": "SET_CURRENT_LAYER",
    "forbid_tools": []
  },
  "vars": {
    "extents": {
      "min": [
        0,
        0
      ],
      "max": [
        12000,
        8000
      ]
    }
  },
  "sequence": [
    {
      "id": "00.status",
      "tool": "get_dxf_summary",
      "args": {}
    },
    {
      "id": "01.layers",
      "macro": "macro:setup_layers",
      "args": {
        "layers": [
          {
            "name": "S-NOTE",
            "aci": 7,
            "linetype": "CONTINUOUS",
            "visible": true
          },
          {
            "name": "Z-TBD",
            "aci": 1,
            "linetype": "DASHED",
            "visible": true
          }
        ]
      }
    },
    {
      "id": "10.table",
      "macro": "macro:member_schedule_table",
      "args": {
        "layer": "S-NOTE",
        "origin": [
          0,
          0
        ],
        "row_h": 300,
        "col_w": [
          800,
          1200,
          600,
          1600
        ],
        "headers": [
          "ID",
          "TYPE",
          "QTY",
          "SPEC"
        ],
        "rows": [
          [
            "B1",
            "BEAM",
            2,
            "H-400x200x8x13"
          ],
          [
            "C1",
            "COLUMN",
            4,
            "H-300x300x10x15"
          ]
        ],
        "text_height": 200
      }
    },
    {
      "id": "90.qa",
      "macro": "macro:qa_snapshot",
      "args": {}
    },
    {
      "id": "99.save",
      "macro": "macro:fit_and_save",
      "args": {
        "path": "S701_member_list_out.dxf"
      }
    }
  ]
}